{
  "id": "wiparse-netcfg",
  "name": "Dongle Network Config",
  "name_zh": "Dongle 网络配置",
  "report_name": "WiparseNetcfg",
  "report_name_zh": "Dongle 配网",
  "type": "instrument",
  "version": "1.2.2",
  "entry": "index.mjs",
  "config": "station.json",
  "description": "WIPARSE-IF CH-NETCFG. Fill 2.4 GHz SSID/PSK, keep DHCP on, APPLY over USB MI_05 EP0 without flashing. Empty SSID/PSK leave NVS unchanged. TCP :1238 is only after GOT_IP.",
  "capabilities": ["preflight", "run", "stop"],
  "engines": {
    "node": ">=18",
    "wiparse": ">=1.1.16"
  },
  "sandbox": {
    "permissions": ["gui.api", "cli", "fs.data_root", "network.outbound"]
  },
  "outputs": [
    {
      "id": "logs",
      "label": "NETCFG log",
      "label_zh": "配置日志",
      "view": "log",
      "dir": "{artifacts_dir}/logs",
      "include": ["*.jsonl", "*.json", "*.txt"]
    },
    {
      "id": "reports",
      "label": "Report",
      "label_zh": "报告",
      "view": "report",
      "dir": "{artifacts_dir}/reports",
      "include": ["*.md"]
    }
  ],
  "params": [
    {
      "name": "ssid",
      "type": "string",
      "path": "wifi.ssid",
      "default": "",
      "group": "wifi",
      "group_zh": "Wi-Fi",
      "label": "Wi-Fi name",
      "label_zh": "Wi-Fi 名称",
      "help": "2.4 GHz SSID only (e.g. WINDLINK, not WINDLINK-5G). Empty = do not overwrite the SSID already stored on the device."
    },
    {
      "name": "psk",
      "type": "string",
      "path": "wifi.psk",
      "default": "",
      "group": "wifi",
      "group_zh": "Wi-Fi",
      "label": "Password",
      "label_zh": "密码",
      "help": "2.4 GHz, 8–63 bytes, never written to logs. Empty = do not overwrite the stored PSK."
    },
    {
      "name": "dhcp",
      "type": "boolean",
      "path": "wifi.dhcp",
      "default": "true",
      "group": "wifi",
      "group_zh": "Wi-Fi",
      "label": "Obtain IP automatically",
      "label_zh": "自动获取 IP",
      "help": "Keep on for a router DHCP lease. Turning it off requires static IPv4, gateway, and netmask in Advanced."
    },
    {
      "name": "op",
      "type": "enum",
      "path": "run.op",
      "default": "apply",
      "group": "wifi",
      "group_zh": "Wi-Fi",
      "label": "Operation",
      "label_zh": "操作",
      "help": "Apply writes NVS and reconnects, then polls STATUS. Query only sends STATUS. SAVE / REVERT / HELP go in the Advanced script.",
      "options": [
        { "value": "apply", "label": "Apply and reconnect", "label_zh": "下发并生效" },
        { "value": "status", "label": "Query STATUS", "label_zh": "查询" }
      ]
    },
    {
      "name": "script",
      "type": "text",
      "path": "run.script",
      "default": "",
      "group": "script",
      "group_zh": "脚本",
      "advanced": true,
      "label": "Script (one cmd/line)",
      "label_zh": "脚本（一行一条）",
      "help": "Non-empty lines (not # comments) are sent as-is and skip the op recipe. Use this for SAVE, REVERT, HELP. APPLY writes NVS and reconnects; do not flash."
    },
    {
      "name": "ip",
      "type": "string",
      "path": "wifi.ip",
      "default": "",
      "group": "wifi",
      "group_zh": "Wi-Fi",
      "advanced": true,
      "label": "Static IPv4",
      "label_zh": "静态 IPv4",
      "help": "Used only when DHCP is off. All three of IPv4, gateway, and netmask are required."
    },
    {
      "name": "gateway",
      "type": "string",
      "path": "wifi.gateway",
      "default": "",
      "group": "wifi",
      "group_zh": "Wi-Fi",
      "advanced": true,
      "label": "Gateway",
      "label_zh": "网关"
    },
    {
      "name": "netmask",
      "type": "string",
      "path": "wifi.netmask",
      "default": "",
      "group": "wifi",
      "group_zh": "Wi-Fi",
      "advanced": true,
      "label": "Netmask",
      "label_zh": "掩码"
    },
    {
      "name": "hostname",
      "type": "string",
      "path": "wifi.hostname",
      "default": "",
      "group": "wifi",
      "group_zh": "Wi-Fi",
      "advanced": true,
      "label": "DHCP display name",
      "label_zh": "DHCP 显示名",
      "help": "Empty = do not send HOSTNAME (firmware uses WiParseDongle_XXXX). Filling this only changes the router DHCP client name, not mDNS."
    },
    {
      "name": "transport",
      "type": "enum",
      "path": "channel.transport",
      "default": "usb",
      "group": "transport",
      "group_zh": "传输",
      "advanced": true,
      "label": "Transport",
      "label_zh": "传输",
      "help": "usb = WinUSB MI_05 EP0 (works when STA is down). auto = USB then TCP only if Host is set. tcp = :1238 after GOT_IP. APPLY over TCP may drop the socket — use USB while disconnected or about to reconnect.",
      "options": [
        { "value": "usb", "label": "USB WinUSB MI_05", "label_zh": "USB（推荐）" },
        { "value": "auto", "label": "Auto USB then TCP", "label_zh": "自动 USB→TCP" },
        { "value": "tcp", "label": "TCP :1238", "label_zh": "TCP" }
      ]
    },
    {
      "name": "host",
      "type": "string",
      "path": "channel.host",
      "default": "",
      "group": "transport",
      "group_zh": "传输",
      "advanced": true,
      "label": "Host",
      "label_zh": "主机",
      "help": "TCP backup only. Use STATUS ip= or wiparsedongle-xxxx.local. Leave empty; do not use dap.local."
    },
    {
      "name": "tcp_port",
      "type": "number",
      "path": "channel.tcp_port",
      "default": 1238,
      "group": "transport",
      "group_zh": "传输",
      "advanced": true,
      "label": "TCP port",
      "label_zh": "TCP 端口"
    },
    {
      "name": "wait_got_ip_ms",
      "type": "number",
      "path": "run.wait_got_ip_ms",
      "default": 30000,
      "group": "wifi",
      "group_zh": "Wi-Fi",
      "advanced": true,
      "label": "Wait for GOT_IP (ms)",
      "label_zh": "等待入网 ms",
      "help": "After APPLY/REVERT, poll STATUS until wifi=1 and ip is not 0.0.0.0. 0 skips the wait."
    },
    {
      "name": "file_prefix",
      "type": "string",
      "path": "paths.file_prefix",
      "default": "WiparseNetcfg",
      "group": "paths",
      "group_zh": "路径",
      "advanced": true,
      "label": "Report name / prefix",
      "label_zh": "报告名称/前缀",
      "help": "Optional override of plugin.json report_name. Sanitized value is tests/{test_id}/."
    },
    {
      "name": "vid",
      "type": "string",
      "path": "channel.vid",
      "default": "C251",
      "group": "transport",
      "group_zh": "传输",
      "advanced": true,
      "label": "USB VID",
      "label_zh": "USB VID"
    },
    {
      "name": "pid",
      "type": "string",
      "path": "channel.pid",
      "default": "F01A",
      "group": "transport",
      "group_zh": "传输",
      "advanced": true,
      "label": "USB PID",
      "label_zh": "USB PID"
    },
    {
      "name": "usb_mi",
      "type": "number",
      "path": "channel.usb_mi",
      "default": 5,
      "group": "transport",
      "group_zh": "传输",
      "advanced": true,
      "label": "USB interface MI",
      "label_zh": "USB 接口号"
    },
    {
      "name": "usb_guid",
      "type": "string",
      "path": "channel.usb_guid",
      "default": "{7B3E9C41-2A18-4F6D-9E50-1C8A6D4B0105}",
      "group": "transport",
      "group_zh": "传输",
      "advanced": true,
      "label": "WinUSB GUID",
      "label_zh": "WinUSB GUID"
    },
    {
      "name": "usb_name",
      "type": "string",
      "path": "channel.usb_name",
      "default": "",
      "group": "transport",
      "group_zh": "传输",
      "advanced": true,
      "label": "USB name contains",
      "label_zh": "USB 名称包含"
    },
    {
      "name": "connect_timeout_ms",
      "type": "number",
      "path": "channel.connect_timeout_ms",
      "default": 4000,
      "group": "transport",
      "group_zh": "传输",
      "advanced": true,
      "label": "Connect timeout (ms)",
      "label_zh": "连接超时 ms"
    }
  ]
}
